{
  "title_tag": "The Debt I Never Paid",
  "theme_type": "self",
  "category": "AFFILIATION",
  "power_tags": [
    "they still take my call",
    "knows what the favour was worth"
  ],
  "weakness_tags": ["cannot refuse when they ask"],
  "quest": "Settle the debt on my own terms, before someone else names them for me.",
  "upgrade": 2,
  "decay": 1,
  "meta": {
    "publication_type": "homebrew",
    "authors": ["schema-in-the-mist contributors"]
  }
}
